Tier,Company,Vertical,Why this is a good Zco target,Zco wedge
1,Panduit,Electrical + network infrastructure solutions,Large SKU catalog + channel/distributor motion creates quoting/configuration + digital self-serve needs,Product configurator + distributor portal + quote workflow
1,Vertiv,Critical digital infrastructure (power/cooling/racks),Complex deployments + service lifecycle (install/maintain) benefit from better customer + field tooling,Field service mobile app + customer portal + monitoring/service workflows
1,Rittal GmbH & Co. KG,Industrial + IT enclosures/infrastructure,Highly configurable enclosure systems typically create friction in spec-to-quote and partner ordering,CPQ/configurator + CAD/BOM automation + partner quoting portal
1,Schneider Electric,Energy management + automation (incl. data center infrastructure),Massive installed base + accessory ecosystem makes portals, renewals, and support workflows high leverage,Asset/warranty portal + renewals + install/service documentation hub
1,nVent HOFFMAN,Enclosures + electrical protection,Spec-driven buying and compliance documentation create strong demand for guided selection + submittals,Spec builder + compliance/submittal generator + rep/distributor workflow
1,Legrand,Electrical + digital building infrastructure (incl. data center),Channel-heavy selling + frequent bundles makes product selection and ordering workflows valuable,Distributor ordering portal + bundle/compatibility recommender + quote requests
1,Eaton,Intelligent power management (incl. data center power),Commissioning/monitoring + service contracts benefit from unified customer and internal workflows,Install/commissioning tooling + monitoring portal + service ticket automation
1,Siemon,High-performance network connectivity (data centers + smart buildings),Project BOMs + standards-driven purchasing benefit from design-to-BOM and submittal automation,Design-to-BOM tool + submittal package generator + contractor portal
2,Tripp Lite,Power protection + racks/PDUs + connectivity,High-volume product selection + post-purchase support (warranty/RMA) can be made more self-serve,Product selection wizard + warranty/RMA portal + support workflow automation
2,Belden Inc.,Connectivity solutions (industrial/networking),Engineering-led buyers need faster design, documentation, and purchasing accuracy,Design-to-BOM tooling + partner portal + documentation/search experience overhaul
2,Hubbell Incorporated,Utility + electrical solutions,Large portfolio + distributor networks often means fragmented digital experiences,Unified distributor portal + cross-catalog search + quote workflow
2,Great Lakes Data Racks & Cabinets,Data center racks/cabinets + industrial enclosures,Build-to-order/custom requirements make guided design + quoting + lead-time visibility valuable,Configurator + quote builder + order/production status portal
2,Upsite Technologies,Data center airflow management,Assessment/ROI-driven selling benefits from calculators, reporting, and customer-facing portals,Assessment + ROI tools + customer reporting dashboard + lead-to-project workflow
2,Subzero Engineering,Data center containment + infrastructure solutions,Custom projects require tight coordination, documentation, and install tracking,Project portal + installation tracking + as-built documentation workflows
2,POLARGY,Data center containment + white space solutions,Retrofit/custom deployments benefit from faster quoting and clearer delivery/install coordination,Quote builder + delivery/install scheduling + customer comms automation
3,Tate,Raised access floors + airflow management,Project-based selling with contractors/GCs creates submittal, scheduling, and lifecycle workflow needs,Contractor portal + submittals/RFIs workflow + delivery scheduling tools
3,Maysteel Industries LLC,Custom metal enclosures (fabrication),Made-to-order manufacturing is sensitive to quoting accuracy + production visibility,CPQ + production visibility portal + exception/QA workflow dashboards